{
  "@context": "https://raw.githubusercontent.com/digital-certificates/cert-schema/kh_receipt/cert_schema/schema/certificate/1.2.0/context.json#",
  "@type": "DigitalCertificate",
  "verify": {
    "@type": "VerificationObject",
    "signer": "https://www.theissuer.edu/keys/signing-public-key.asc",
    "attribute-signed": "uid",
    "type": "ECDSA(secp256k1)"
  },
  "recipient": {
    "@type": "Recipient",
    "type": "email",
    "familyName": "RecipientLastName",
    "hashed": false,
    "givenName": "RecipientFirstName",
    "pubkey": "n1EduLzKsTL1pM8Roz9vEV16AQnBdg9JCx",
    "identity": "recipient@domain.com"
  },
  "certificate": {
    "@type": "Certificate",
    "subtitle": "2016",
    "description": "Certificate description",
    "title": "Certificate title",
    "image:certificate": "data:image/png;base64,",
    "id": "https://www.theissuer.edu/criteria/2016/05/certificate-type.json",
    "issuer": {
      "@type": "Issuer",
      "url": "http://www.theissuer.edu",
      "name": "Issuing Institution",
      "id": "https://www.theissuer.edu/issuer/the-issuer.json",
      "image:logo": "data:image/png;base64,",
      "email": "issuer@theissuer.edu"
    }
  },
  "assertion": {
    "@type": "Assertion",
    "issuedOn": "2016-05-26T12:00:00Z",
    "image:signature": "data:image/png;base64,",
    "id": "http://www.theissuer.edu/fb9e6259-f3ee-438a-b98f-a24f54187af8",
    "uid": "fb9e6259-f3ee-438a-b98f-a24f54187af8",
    "evidence": "https://www.theissuer.edu/issuer/the-issuer.json"
  }
}
